"Ani wanta hamaa isaan irra nan tuula, xiyyoolii koo hundumaas isaanittan badduu baasa;
beela isaan dadhabsiisu isaanittan erga, golfaa nama fixuu fi dha'icha nama ajjeesus, ilkaan bineensotaa, hadhaa bineensota lafa munyuuqaniis isaanittan erga.
Alaa billaan isaan harkaa ijoollee in fixa, mana keessas sodaan jira; dargaggeessonnii fi durboonni, daa'imoonii fi jaarsoliin in balleeffamu.
Ani, 'Iddoo fagootti isaan nan tamsaasa, seenaa isaaniis immoo namoota gidduudhaa nan balleessa' nan jedhan ture.
Garuu diinonni, 'Irree keenyatu mo'e malee, Waaqayyo kana hundumaa hin goone' jedhanii akka ana hin aarsineefan dhiise.
"Sabni akkasii garuu saba gorsa hin qabnee dha, hubachuunis isa keessa hin jiru;
maaloo, utuu ogeessota ta'anii kana hubatanii, dhumni isaaniis attam akka ta'u utuu beekanii!
Kattaan isaanii yoo isaan gurgure malee, Waaqayyo yoo gad isaan dhiise malee, attamitti namni tokko nama kuma ari'uu danda'a? Yookiis attamitti namni kumni kudhan nama lama baqata?
Kattaan isaanii akka kattaa keenyaa miti, diinonni keenya iyyuu kana in faradu.
Mukti waynii isaanii Sodoom keessaa fi maasii Gomoraa keessaa dhufa, iji waynii isaanii hadhaadhaan guutuu dha, dameen isaaniis hadhaa'ummaa qaba.
Daadhiin waynii isaanii hadhaa bofaa ti, hadhaa mar'ataa isa nama ajjeesuu ti.
"Kun ana biratti walitti hin qabamnee ree, gombisaa koo keessattis mallattoodhaan itti hin cufamnee ree?
Ijaa baasuunii fi adabuun kan koo ti, yeroon miilli isaanii itti mucucaatu jira, guyyaan badiisa isaaniis dhi'aateera, firdiinis dafee isaanitti in dhufa" jedhe.
Humni isaanii akka dhume, warri birmaduun, garboonnis tokko illee akka hin hafne Waaqayyo waan argeef, saba isaatiif in farada, garboota isaatiifis in oo'a.
Waaqayyo yommus, "Waaqayyoliin isaanii, kattaan isaan itti kooluu galanis meerree?
Waaqayyoliin warri cooma aarsaa qalma isaanii nyaatan, warri kennaa dhugaatii daadhii waynii isaanii dhuganis mee ka'anii isaan haa gargaaran kaa! Mee iddoo baqaa isaaniif haa ta'an kaa!
"Amma ilaalaa! Waaqayyo anuma, ana malee Waaqayyo kan biraa hin jiru; ani nan ajjeesa, ani nan jiraachisas; ani nan madeessa, ani nan fayyisas; homtinuu harka koo keessaa baasuu kan danda'u hin jiru;
ani harka koo bantii waaqaa irra bal'isee, 'Ani bara baraan jiraataa dha' jedhee nan kakadha.
Billaa koo isa calaqqisaa yommuun qaradhu, harki koos firdiidhaaf yommuu isa qabatu, ani diinota koo irratti ijaa nan ba'a, warra na jibbaniifis gatii nan baasa;
xiyyoolii koo dhiigaan nan macheessa, dhiiga warra qalamanii fi warra booji'amanii, geggeessitoota diinotaa nan obaasa, billaa koos foon nan nyaachisa" in jedha.
Yaa saba lafa irraa, saba isaatiif gammadaa! Waaqayyo dhiiga garboota isaatiif ijaa in baasa, diinota isaa irratti ijaa in ba'a, saba isaa fi biyya isaatti in araarama.
Museenis Iyaasuu ilma Nunii wajjin dhufee dubbii faarfannaa kanaa hundumaa sabni akka dhaga'utti itti dubbate.
Museen dubbii kana hundumaa guutummaa Israa'elitti erga himee booddee,
"Dubbii ani har'a isinitti beeksisu kana hundumaa garaa keessan keessa kaa'adhaa! Ijoolleen keessanis dubbii seera kanaa hundumaa gaarii godhanii akka eeganiif isaan abboomaa!
Dubbichi jireenya keessan malee, dubbii isiniif waa'ee hin baafne miti; dubbichaanis biyya isa Yordaanosin ceetanii qabachuuf jirtan sana keessa bara dheeraa in jiraattu" jedhe.
Guyyuma sana Waaqayyo Museedhaan,
"Gara tulluu Abaariim, tulluu Neboo isa biyya Mo'aab keessaa fuullee Yerikoo jiru sanatti ol ba'i! Biyya Kana'aan isa ani Israa'elootaaf dhuunfaa godhee kennu sana ilaali!
Akkuma Aaron obboleessi kee tulluu Hoor irratti du'ee abboota isaa biratti sassaabame, atis tulluu itti ol baatu sana irratti in duuta abboota kee birattis in sassaabamta!
Kunis isin Israa'eloota duratti bishaan Mariibaa isa mandara Qaadeshitti dhi'oo jiru biratti, lafa onaa Siin keessatti waan na yakkitanii fi Israa'eloota gidduutti qulqullummaa koo ulfinaan waan hin eeginiif isinitti in dhufa.
Ati biyyicha fuulleetti in argita, garuu ofii keetii biyya ani Israa'elootaaf kennu sanatti hin galtu" jedhe.
Eebbi Museen namni Waaqayyoo utuu hin du'in dura ittiin Israa'eloota eebbise isa kanatti fufee jiruu dha;
yommus inni, "Waaqayyo Siinaadhaa dhufe, Se'iir irraa akka bariitti isaaniif in ba'e, tulluu Phaaraan gubbaadhaas isaaniif in ibse; qulqulloota kumaatamaa wajjinis ba'e, gara mirgaa isaattis ibiddi seeraa isaaniif in boba'e.
Dhuguma inni saba isaa in jaallata, warri qulqulloonnis harka isaa keessa jiru; isaan hundinuu miilla isaa jalatti in kufu, isa biraas barsiisa in argatu" jedhe.
Waldaa Yaaqoobiif dhuunfaa akka ta'uuf, Museen seera nuuf kenneera;
yeroo geggeessitoonni sabaa walitti qabaman, yeroo gosi Israa'elis wal ga'an, Waaqayyo Yeshuuruun irratti mootii ture.
Yommus Museen, "Lakkoobsi namoota isaa muraasa ta'u illee, horteen Ruuben haa jiraatu malee, du'ee hin dhumin!" jedhe.
Waa'ee Yihudaaf immoo, "Yaa Waaqayyo, sagalee Yihudaa dhaga'i! Gara saba isaattis isa fidi! Inni harka isaatiin ofiif in lola, atis isa gargaarii diinota isaa loli!" jedhe.
Waa'ee Lewwiitiif, "Uriimii fi Tumiimin Lewwiidhaaf kenni! Nama isa jaallatte sanaaf, isa Maasaatti isa qorte sanaaf, isa bishaan Mariibaa biratti lolte sanaaf,
inni isa waa'ee abbaa isaa fi haadha isaa, 'Ani isaan hin argine' jedhee dha; obboloota isaa hin beekne, ijoollee isaas 'Kan koo ti' jedhee hin fudhanne, isaan garuu dubbii keef in abboomaman, kakuu kees in eegan.
Isaan wanta qajeelaa ta'e isa kan keetii Yaaqoobin, seera kees Israa'elin in barsiisu; isaan aarsaa ixaanaa si dura, guutummaa aarsaa gubatus iddoo aarsaa kee irra in kaa'u.
Yaa Waaqayyo, ati humna isaa eebbisi! Hojii harka isaas fudhadhuuf! Mudhii diinota isaa warra isa jibbanii, akka isaan deebi'anii lafaa hin kaanetti cabsi!" jedhe.
Waa'ee Beniyaaminis, "Inni Waaqayyo isa jaallatu, sodaa malee isa bira in jiraata, Waaqayyos guyyaa hundumaa isa in golbooba, innis eegumsa Waaqayyoo jala in jiraata" jedhe.
Waa'ee Yoseef immoo, "Waaqayyo fixeensa isa gubbaa waaqaatiin, bishaan isa lafa gad fagoo keessa jiruunis lafa isaa haa eebbisu!
Wanta gaarii, wanta aduun ija itti godhuun, wanta baay'ee gaarii ji'i kennuunis,
wanta baay'ee gaarii tulluu durii irraa argamuun, wanta baay'ee gaarii gaarota bara baraa irraa argamaniinis,
guutummaa wanta lafti baasu isa caalaadhaan, ayyaana isa huuxxii qoraattii boba'u keessatti argame sanaatiin, kun hundinuu mataa Yoseef irra, gubbee mataa isa obboloota isaa keessaa addaan ba'ee irra haa buufatu!
Kormi isaa inni angafni attam surra-qabeessaa! Gaanfonni isaas akka gaanfota gafarsaa ti; gaanfota isaa sanaanis saba hundumaa hamma daarii lafaatti in waraana; Efreem kan akkasii kuma kudhan qaba, Minaaseenis kumaatama qaba" jedhe.
Waa'ee Zebuloon immoo, "Yaa Zebuloon, ati ba'uu keetti, yaa Yisaakor, atis godoo kee keessatti gammadi!
Isaanis saba gara tullootaatti in waamu, achittis isaan kennaa qajeelaa in dhi'eessu, qabeenya galaana keessaas in xuuxu, badhaadhummaa cirracha keessa dhokates in baafatu" jedhe.
Waa'ee Gaadi, "Gaadin kan bal'isu eebbifamaa dha, Gaadi akka leenca dhalaa in ripha, harkaa fi gubbee mataas in kukkuta.
Biyyicha keessaa isa caalu ofii isaatiif dura in fo'ata, ga'aan warra geggeessitootaas isaaf kaa'ame, angafoonni sabaa yommuu wal ga'an, inni fedha Waaqayyoo isa qajeelaa in raawwate, firdii isaas Israa'elii wajjin in eege" jedhe.
Waa'ee Daan immoo, "Daan akka ilmoolee leencaa, isa Baashaan keessaa utaaluu ti" jedhe.
Waa'ee Niftaalemis, "Yaa Niftaalem ati ayyaana quufteetta, eebba Waaqayyoos guutummaatti, ciisa bishaan galaanaatii jalqabdee hamma biyya gara mirgaatti dhaali!" jedhe.
Waa'ee Asheer immoo, "Asheer ilmaan warra kaan caalaatti eebbifamaa haa ta'u! Obboloonni isaa isa haa jaallatan! Miilla isaas dhadhaa ejersaatiin haa dhiqatu!
Cufaan karra isaas sibiilaa fi sibiila boorrajjii haa ta'u! Jabinni isaas bara isaa wajjin wal haa qixxaatu" jedhe.
Museen ammas itti fufee, "Waaqayyo inni akka Waaqayyo isa kan Yeshuuruun tokko illee hin jiru, inni si gargaaruudhaaf bantiiwwan waaqaa yaabbatee adeemu, ulfina isaatiinis duumessa irra kan taa'u,
Waaqayyo inni bara baraa kun iddoo jireenya keetii ti; irreen bara baraas isa jala jira, inni diinota kee si duraa in oofa, 'Isaan balleessis!' in jedha;   Israa'el kophaa isaa bir'aa malee in jiraata, sanyiin Yaaqoobis, biyya midhaanii fi daadhii waynii baasu keessa, biyya waaqni fixeensa gad itti coccophsu keessas nagaatti in taa'a.
Yaa Israa'el, ati gammadi! Eenyu sabni akka kee Waaqayyo oolche? Gaachanni kee fi kee gargaarsi kee isa; billaan kee inni ulfina-qabeessis, diinonni kee si dura in quphanu, ati immoo iddoo isaanii isa ol jedhaa irra in ejjetta" jedhe.
Ergasii Museen dachaa Mo'aabii gara tulluu Neboo gara gubbee Phiisgaa isa fuullee Yerikootti ol in ba'e; achitti Waaqayyo biyya sana hundumaa, Giil'aadii hamma Daanitti,
biyya Niftaalem hundumaa, biyya Efreemii fi kan Minaasee, biyya Yihudaa hundumaa hamma galaana isa gara lixa-biiftuu jiruutti,
gara mirgaas, biyya dachaa Yerikoo jiru hundumaa, mandara muka meexxiitii hamma Zo'aaritti in argisiise.
Waaqayyo yommus Museedhaan, "Isa kana biyyi ani Abrahaamin, Yisihaqin, Yaaqoobinis, 'Ani sanyii keessaniif nan kenna' jedhee kakuudhaan abdachiise; ati isa ija keetiin argiteetta, garuu ati achi hin ceetu!" jedhe.
Kana booddee Museen garbichi Waaqayyoo akkuma Waaqayyo jedhee ture sana biyya Mo'aabitti in du'e.
Waaqayyo dachaa biyya Mo'aabitti fuullee Bet-Phe'oritti isa in awwaale; haa ta'u iyyuu malee, hamma har'aatti iyyuu namni iddoo awwaala isaa beeku hin jiru.
Museen yommuu du'e sana nama waggaa dhibbaa fi digdamaa ture; iji isaa hin dimimmifne, humni isaas irraa hin hir'anne.
Israa'eloonni dachaa Mo'aabitti guyyaa soddoma Museedhaaf in gaddan, kana booddee yeroon boo'ichaa fi gaddaa in raawwatame.
Iyaasuu ilmi Nun yeroo sanatti Museen harka isaa waan isa irra kaa'eef hafuurri ogummaa isa keessa guutee ture; Israa'eloonni isaaf dhaga'anii waan Waaqayyo karaa Musee abboomee tures in godhan.
Ergasii raajiin Waaqayyo fuula fuulaan beeke, kan akka Musee takkaa Israa'el keessatti hin kaane.
Raajiin milikkitaa fi dinqii hundumaa biyya Gibxiitti, Fara'oon irratti, hojjetoota isaa hundumaa irratti, biyya isaa hundumaa irrattis akka hojjetuuf Waaqayyo erge,
humna guddaa fi gocha sodaachisaa isa Museen guutummaa Israa'el duratti argisiise kana hundumaas kan godhe hin kaane.
Museen garbichi Waaqayyoo erga du'ee booddee, Waaqayyo kunoo, Iyaasuu ilma Nun gargaartuu Museetti in dubbate.
Inni, "Museen garbichi koo du'eera; egaa amma atii fi sabni kun hundinuu ka'aatii laga Yordaanos kana ce'aatii gara biyya isa ani saba Israa'eliif kennu sanaa dhaqaa!
Ani akkuman Musee abdachiisetti lafa faanni miilla keessanii irra ejjetu hundumaa isiniif nan kenna.
Daariin keessan lafa onaa kanaa ka'ee Liibaanoniin ba'ee hamma laga guddichaa laga Efraaxiisitti, gara lixa-biiftuutiin immoo biyya Heetotaa hundumaa qabatee hamma galaana guddichaatti in adeema.
Bara jireenya kee hundumaatti namni si dura dhaabachuu danda'u hin jiru; Musee wajjin akkuman ture sii wajjinis nan ta'a; ani si hin dhiisu, si hin irraanfadhus!
Biyya ani isaaniif kennuuf abboota isaaniif kakadhe akka isaan dhaalan waan gootuuf cimi, ija jabaadhu!
Cimi, ija jabaadhus! Seera Museen garbichi koo si abboome hundumaa eeguudhaaf of eeggadhu! Iddoo dhaqxu hundumaatti wanti ati gootu akka wal siif qixxaatutti isa irraa gara mirgaatti yookiis gara bitaatti hin jal'atin!
Macaafni seeraa kun afaan kee keessaa hin dhabamin! Halkanii fi guyyaas waa'ee isaa yaadi! Karaan kee akka siif qajeelutti, wanti ati gootus akka wal siif qixxaatutti, wanta isa keessatti caafame hundumaa gaarii godhii eegi!
Ani Waaqayyo gooftaan kee, 'Iddoo ati dhaqxu hundumaatti sii wajjinan jiraatii ati cimi, ija jabaadhu, hin sodaatin, hin na'inis!' jedhee si hin abboomnee ree?" jedhe.
Iyaasuunis kana irratti geggeessitoota sabaatti in dubbate;
inni, "Iddoo buufataa keessa adeemaatii namootaan, 'Guyyaa sadii gidduutti biyya Waaqayyo gooftaan keessan akka isin qabattaniif isiniif kennu sana dhaquudhaaf laga Yordaanos kana in ceetuutii ka'aatii galaa qopheeffadhaa!' jedhaa!" jedhee isaan in abboome.
Iyaasuun yommus gosa Ruubenii fi gosa Gaadiin, Minaasee isa walakkaa gosaatiinis,
"Dubbii Museen garbichi Waaqayyoo isin abboome yaadadhaa! Waaqayyo gooftaan keessan boqonnaa isiniif in kenna, lafa kanas isiniif in kenna.
Dubartoonni keessanii fi ijoolleen keessan, horiin keessanis biyya isa Museen Yordaanos gara ba'a-biiftuutii isiniif kenne keessa haa taa'an! Isin warri loltoonni mi'a lolaa hidhattan hundinuu immoo obboloota keessan dura bu'aa ce'aatii isaan gargaaraa!
Waaqayyo gooftaan keessan akkuma boqonnaa isaaniif kenne, obboloota keessaniifis boqonnaa yommuu kennu, isaanis immoo lafa Waaqayyo gooftaan keessan isaaniif kennu fudhatanii dhuunfaa isaanii hamma godhatanitti isaan in gargaartu; kana booddee immoo biyya dhaala keessanii isa Museen garbichi Waaqayyoo Yordaanos boroodhaa gara ba'a-biiftuutiin isiniif kennetti deebi'aatii taa'aa!" jedhe.
Isaan yommus deebisanii Iyaasuudhaan, "Wanta ati nu abboomte hundumaa in goona, iddoo ati itti nu ergite hundumaas in dhaqna;
Waaqayyo gooftaan kee Musee wajjin akkuma ture sii wajjinis immoo haa ta'u duwwaa malee, akkuma Museedhaaf wanta hundumaatti abboomamne, siifis in abboomamna;
namni abboommii keetiin mormu, namni dubbii kees hin dhageenye hundinuu haa ajjeefamu! Ati garuu cimi, ija jabaadhu!" jedhan.
Iyaasuun ilmi Nun ergasii Shiixiimii gaaddota lama dhoksaatti ergee, "Dhaqaatii biyyicha, caalaatti immoo mandara Yerikoo ilaalaa!" jedheen; isaanis in dhaqan; yommuu achi ga'an mana dubartii ejjituu "Rahaab" jedhamtu tokkoo dhaqanii achi in buufatan.
Mootii Yerikoottis, "Kunoo, namoonni Israa'el biyyicha gaaduudhaaf halkan kana dhufaniiru" jedhanii himan.
Kana irratti mootiin Yerikoo Rahaabitti ergee, "Namoonni gara kee dhufanii mana kee jiran kun guutummaa biyyichaa gaaduudhaaf waan dhufaniif gad isaan baasi!" jedhe.
Dubartiin sun garuu namoota sana lamaan dhoksitee, "Eyyee dhuguma, jarreen tokko gara koo dhufaniiru, garuu eessaa akka isaan dhufan ani hin beeku.
Isaan yeroo dimimmisee balballi kellaa mandaraa cufamutti ba'an; ani lafa isaan dhaqan hin beeku; dafaa isaan hordofaa in qaqqabdu" jette.
Jara immoo bantii manaatti ol baaftee muka talbaa bantii manaa irra afamee ture jala dhoksite.
Jarri ergaman sun hamma malkaa ce'umsa Yordaanositti duukaa bu'uudhaaf erga ba'anii booddee karri kellichaa in cufame.
Warri gaadduun sun utuu hin ciisin isheen bantii manaa irratti isaan bira dhaqxee,
isaaniin, "Waaqayyo biyya kana akka isiniif kenne ani beeka, nuyi isin in sodaanne, warri biyya kanaa hundinuu na'anii isin duraa akkuma gagaa baqaniiru.
Yommuu isin biyya Gibxii baatan, akka Waaqayyo galaana diimaa fuula keessan duraa gogse, waan isin Sihoonii fi Oog mootii Amoorotaa warra Yordaanos irraa gara ba'a-biiftuu turan lamaan gootan, isin raawwattanii akka isaan balleessitanis nu'oo dhageenyeerra.
Nuyi yommuu waa'ee kanaa dhageenye, isin sodaannee onneen keenya akkuma gagaa in baqe; Waaqayyo gooftaan keessan ol waaqa irratti, gad lafa irrattis Waaqayyo waan ta'eef, namni na'ee abdii hin kutatin hin turre.
Egaa akkuman gaarii isiniif godhe, isinis mana abbaa koof gaarii akka gootan maqaa Waaqayyootiin anaaf kakadhaa, milikkita amansiisus anaaf kennaa!
Abbaa koo, haadha koo, obboloota koo, obboleettota koo waan isaan qaban hundumaas oolchaa, du'a jalaas baasaa!" jette.
Jarris deebisanii isheedhaan, "Wanta nuyi amma hojjechaa jirru kana hin himtan yoo ta'e, Waaqayyo biyyicha yommuu nuuf kennu, nu immoo gaarummaa fi amanamummaa yoo isin argisiisuu dhabaane, iddoo keessan nu haa ajjeesu!" jedhan.
Manni dubartittiin keessa jiraattu gar tokkoon kellaa mandarichaa wajjin walitti waan ijaarameef, karaa qaawwa kellichaa funyoodhaan gad isaan buufte;
jaraanis, "Warri isin hordofan akka isin hin arginetti, gara tulluu dhaqaatii hamma isaan deebi'anitti guyyaa sadii achi dhokadhaa, isa booddees karaa keessan irra bu'aa!" jette.
Jarri immoo, "Kakaa amma nu kaksiifatte kanaaf ati akka nu hin komannetti,
yommuu nuyi biyya kanatti lixnu qaawwa isa amma keessaan gad nu buufte kanatti fo'aa bildiimaa kana hiitee, abbaa kee fi haadha kee, obboloota kee fi maatii abbaa keetii hundumaa mana keetti sassaabuun si irra jira.
Namni mana keetii ala ba'ee karaa irratti yoo argame, gumaan isaa matuma isaa irra in ta'a; nuyi itti hin gaafatamnu; nama sii wajjin mana keessa jiru irratti namni harka isaa yoo ol fudhate garuu, nuyi itti in gaafatamna.
Wanta nuyi hojjennu kana yoo himte garuu, kakaan ati nu kaksiifte kun nu irra hin ga'u" jedhan.
Isheenis deebiftee, "Akkuma isin jettan haa ta'u!" jettee, isaan gad dhiifte; isaanis ka'anii in sokkan; isheen immoo fo'aa bildiimaa sana qaawwichatti in hiite.
Hamma warri isaan hordofuudhaaf ka'an karaa irra isaan barbaadanii dhabanii deebi'anitti, isaan gara tulluu dhaqanii guyyaa sadii achi taa'an.
Kana booddee namoonni sun lamaanis deebi'anii tulluu irraa gad bu'anii, laga ce'anii Iyaasuu ilma Nun bira dhufanii wanta isaan irra ga'e hundumaa itti himan.
Isaan, "Waaqayyo dhugumaan guutummaa biyyichaa harka keenya keessa buuseera, warri biyyasii hundinuu sababii nu sodaataniif nu duraa akkuma gagaa baqaniiru" jedhanii Iyaasuutti himan.
Iyaasuunii fi Israa'eloonni hundinuu Shiixiimii ganama bariidhaan ka'anii gara laga Yordaanos in dhaqan; utuu lagicha hin ce'in achuma in buufatan.
Guyyaa sadii booddees warri geggeessitoonni iddoo buufataa keessa adeemanii,
namoota ajajanii, "Sanduuqa kakuu Waaqayyo gooftaa keessanii isa Lewwoonni warri luboonni baatan yommuu argitan, iddoo buufattanii ka'aatii isa duukaa bu'aa!
Isin kanaan dura karaa kana baatanii waan hin beekneef, amma isa ilaaltanii yoo adeemtan, karaa irra adeemtan in beektu; haa ta'u iyyuu malee sanduuqichi akka dhundhuma kuma lamaa isinittii fagaatee haa adeemu; kana caalaa itti hin dhi'aatinaa!" jedhan.
Iyaasuun yommus jaraan, "Waaqayyo bor wanta dinqisiisaa isin gidduutti waan hojjetuuf, of qulleessaa!" jedhe.
Iyaasuun kana booddees lubootaan, "Sanduuqa kakuu ol fudhadhaatii jara dura bu'aa adeemaa!" jedhe; kana irratti isaan sanduuqa kakuu sana baatanii jara dura in adeeman.
Waaqayyo ergasii Iyaasuudhaan, "Musee wajjin akkan ture akkasuma immoo sii wajjin ta'uu koo warri Israa'el akka beekanitti, ani har'a ija isaanii duratti nama guddaa si gochuu nan jalqaba.
Ati immoo luboota sanduuqa kakuu sana baatan, 'Qarqara bishaan Yordaanos yommuu geessan, bishaanichatti lixaa keessa dhaabadhaa!' jedhii ajaji!" jedhe.
Kana irratti Iyaasuun Israa'elootaan, "As dhi'aadhaatii, dubbii Waaqayyo gooftaa keessanii dhaga'aa!
Waaqayyo inni jiraataan isin gidduu akka jiru, inni dhugumaan Kana'aanota, Heetota, Hiiwota, Pheriizota, Girgaashota, Amoorota, Yibusootas fuula keessan duraa oofee akka baasu in beektu.
Kunoo, sanduuqi kakuu Waaqayyo gooftaa biyya lafaa hundumaa isin dura bu'ee Yordaanositti in lixa.
Ammas gosoota Israa'el keessaa nama tokko tokko fo'adhaatii nama kudha lama dhi'eessaa!
Akkuma luboonni warri sanduuqa kakuu Waaqayyo gooftaa biyya lafaa hundumaa baatan faana miilla isaanii bishaan Yordaanos keessa kaa'aniin, bishaanichi gararraadhaa gad yaa'aa jiru akka tuullaa ta'ee in dhaabata" jedhe.
Yommuu sabni laga Yordaanos ce'uudhaaf iddoo buufataatii ka'an, luboonni sanduuqa kakuu baatanis isaan dura bu'anii in adeeman.
Lagni Yordaanos guutummaa ji'a midhaan sassaabamuu keessa waan guutuuf, ammas guutee manii isaa keessaa ba'ee ture; haa ta'u iyyuu malee, luboonni warri sanduuqa kakuu baatan laga Yordaanos ga'anii, miilla isaanii hidhii bishaanichaa keessa akkuma kaa'aniin,
bishaanichi yaa'uu dhiisee in dhaabate; inni gararraadhaa gad yaa'aa jiru ol ka'ee hamma mandara Adaam isa Zaaretaanitti dhi'oo jirutti ol fagaatee in tuulame; bishaanichi inni gad darbe gara galaana Arabaayi isa "Galaana soogiddaa" jedhamutti yaa'u immoo raawwatee irraa in cite; sabni sun garuu fuullee Yerikootiin in ce'an.
Yeroo Israa'eloonni hundinuu Yordaanos keessa lafa gogaa irra ce'aa turan, luboonni warri sanduuqa kakuu Waaqayyoo baatan immoo, hamma sabni sun guutummaatti Yordaanos keessa adeemee ce'utti, jabaatanii laga Yordaanos walakkaa lafa gogaa irra in dhaabatu turan.
Sabni guutummaatti Yordaanosin erga ce'ee booddee, Waaqayyo Iyaasuudhaan,
"Gosoota kana keessaa adda addaan nama tokko tokko fo'adhuutii nama kudha lama dhi'eessi!
Bishaan Yordaanos walakkaa iddoo miilli lubootaa ijaajjaa jiru dhagoota kudha lama fuudhaatii iddoo galgala kana bultan lafa naqaa!" jedhe.
Iyaasuun yommus Israa'eloota keessaa nama tokko tokko warra gosoota keessaa fo'aman kudha lamaan sana walitti in waame.
Inni isaaniin, "Sanduuqa kakuu isa kan Waaqayyo gooftaa keessanii dura darbaatii, hamma bishaan Yordaanos walakkaatti adeemaa! Akka lakkoobsa gosoota ilmaan Israa'elitti tokkon tokkon keessan dhagaa tokko tokko fuudhaatii gatiittii keessanitti baadhaa!
Kunis isin gidduutti akka milikkitaatti haa hojjetu! Eger bor ijoolleen keessan, 'Dhagoonni kun maal isiniif godhu?' jedhanii yommuu isin gaafatan,
isin immoo, 'Bishaan Yordaanos utuma yaa'uutti jiruu sanduuqa kakuu isa kan Waaqayyoo duraa gargar in cite; sanduuqi kakuu yommuu Yordaanosin ce'e, bishaan Yordaanos waan gargar citeef, dhagoonni kun namoota Israa'eliif bara hundumaa seenaa in ta'u' jedhanii haa himan!" jedhe.
Kana irratti Israa'eloonni akkuma Iyaasuun isaan abboome in godhan; isaan akkuma Waaqayyo Iyaasuu abboome akka lakkoobsa gosoota ilmaan Israa'elitti dhagoota kudha lama bishaan Yordaanos walakkaadhaa fuudhanii baatanii iddoo buufata isaaniitti geessanii lafa in naqan.
Iyaasuun immoo dhagoota kudha lama bishaan Yordaanos walakkaa lafa luboonni warri sanduuqa kakuu baatan dhaabachaa turan ol qajeelchee in dhaabe; dhagoonni kunis hamma har'aatti iyyuu achuma jiru.
Dubbiin Waaqayyo sabatti himi jedhee Iyaasuu abboome hundinuu akka isa Museen Iyaasuu abboometti hamma raawwatamutti, luboonni warri sanduuqa kakuu baatan bishaan Yordaanos walakkaa in dhaabatan; sabni immoo ariitiidhaan in ce'e.
Erga isaan hundinuu ce'anii raawwatanii booddee, luboonni sanduuqa kakuu isa kan Waaqayyoo baatan ce'anii sabicha dura in darban.
Ilmaan Ruubenii fi ilmaan Gaadi, ilmaan Minaasee isa walakkaa gosaas akkuma Museen isaan ajajetti mi'a lolaa hidhatanii Israa'eloota dura bu'anii in ce'an.
Namoonni mi'a lolaa hidhatanii fuula Waaqayyoo duratti lolaaf dachaa Yerikootti ce'an akka kuma afurtamaa turan.
Yeroo sana Waaqayyo guutummaa Israa'el duratti Iyaasuu nama guddaa godhe; isaan akkuma bara jireenya isaa hundumaatti Musee sodaachaa turan, isas in sodaatan.
"Luboonni warri sanduuqa dhuga-baatuu baatan bishaan Yordaanos keessaa akka ba'an abboomi!" jedhe.
Iyaasuunis, "Bishaan Yordaanos keessaa ba'aa!" jedhee luboota in abboome.
Luboonni warri sanduuqa kakuu Waaqayyoo baatan Yordaanos keessaa ba'anii miilli isaanii lafa gogaa irra yommuu ejjete, bishaan Yordaanos iddoo isaatti deebi'ee akkuma isaa durii guutee manii isaa irra in danbali'e.
Yommus sabni sun ji'a isa duraa, ji'icha keessaa guyyaa kurnaffaatti laga Yordaanos keessaa ba'ee daarii Yerikoo gara ba'a-biiftuutiin mandara Giilgal in buufate.
Kana booddee Iyaasuun dhagoota kudha lamaan jarri Yordaanos keessaa fuudhan ol qajeelchee Giilgal keessa in dhaabe.
Inni Israa'elootaan, "Eger bor ijoolleen keessan, 'Dhagoonni kun maali?' jedhanii isin abboota isaanii yommuu gaafatan,
isin immoo, 'Warri Israa'el Yordaanos kana lafa gogaa irra ce'an' jettanii ijoollee keessanitti in himtu.
'Waaqayyo gooftaan keessan hamma nuyi ceenutti galaana diimaa fuula keenya duraa akkuma gogse akkasuma immoo hamma isin ceetanitti Yordaanosin fuula keessan duraa in gogse.
Sabni warri kaan hundinuu harki Waaqayyoo jabaa ta'uu isaa akka beekaniif isinis bara hundumaa Waaqayyoon gooftaa keessan akka sodaattaniif kana godhe' jedhaa!" jedhe.
Mootonni Amoorotaa warri Yordaanos gama gara lixa-biiftuu jiran hundinuu, mootonni Kana'aanotaa warri daarii galaana guddichaa jiran hundinuus, Waaqayyo hamma Israa'eloonni Yordaanos ce'anitti bishaan Yordaanos akka gogse yommuu dhaga'an, Israa'eloota duratti onneen isaanii akka gagaa baqe, hafuuraa in citan.
Waaqayyo yommus Iyaasuudhaan, "Dhagaa qara qabu qopheeffadhuutii ammas Israa'eloota dhagna qabi!" jedhe.
Kana irratti Iyaasuun dhagaa qara qabu qopheeffatee Gibi'aat-Haaraalotitti Israa'eloota dhagna in qabe.   Iya  :  "Gibi'aat-Haaraalot" jechuun "Tulluu dhagna-qabaa" jechuu dha.
Namoota biyya Gibxii ba'an keessaa dhiironni warri waggaan isaanii duulaaf ga'e hundinuu, Gibxii erga ba'anii booddee lafa onaa keessatti karaatti waan du'aniif, Iyaasuun isaan kana dhagna in qabe.
Namoonni warri biyya Gibxii ba'an hundinuu dhagna qabatanii turan; warri booddee lafa onaa keessatti karaatti dhalatan hundinuu garuu dhagna hin qabanne turan.
Israa'eloonni waggaa afurtama lafa onaa keessa deddeebi'an; namoonni warri biyya Gibxii yommuu ba'an waggaan isaanii duulaaf ga'e hundinuu sagalee Waaqayyoof abboomamuu waan didaniif in dhuman; Waaqayyo biyya isa aannanii fi damma baasu, isa nuuf kennuudhaaf abboota isaanii abdachiise kana akka isaan hin argisiifne in kakate.
Kanaaf Iyaasuun ijoollee isaanii warra isaan booddeedhaan ka'an dhagna qabee iddoo abboota isaanii isaan buuse; isaan karaa irra waan turaniif utuu dhagna hin qabatin turan.
Sabni guutummaatti erga dhagna qabamee booddee, hamma fayyutti iddoo buufata isaa keessa ture.
Waaqayyo yommus Iyaasuudhaan, "Ani har'a arrabsoo warra Gibxii si irraa garagalcheera" jedhe; kanaaf maqaan iddoo sanaa hamma har'aatti "Giilgal" jedhamee waamame.
Israa'eloonni Giilgalin buufatanii utuu jiranii ji'icha keessaa guyyaa kudha afuraffaa galgala dachaa Yerikootti Faasiikaa in ayyaaneffatan.
Isaan borumtaa ayyaana Faasiikaa sana midhaan biyya sanaa keessaa maxinoo fi akaayii nyaatan.
Maannaan borumtaa isaan midhaan biyya sanaa nyaatan dhaabate; Israa'eloonni waggaa sana keessa midhaan biyyi Kana'aan baasu nyaatan malee, ergasii deebi'anii maannaa hin arganne.
Iyaasuun mandara Yerikootti yommuu dhi'aate, ol ilaalee nama billaa luqqifamaa harkatti qabatee isa dura ijaajju tokko argee, gara isaa dhaqee, "Ati gara keenya moo gara diinota keenyaa ti?" jedhee isa gaafate.
