Allaattiin du'aa 'eega, duuti allaattii eega.
Allaattiin fira fakkaatee simbira nyaata.
Allaattiin foon baattu ofii hin yaattu namaa hin laattu.
Allaattiin jooraa ooltu reeffi lafuma.
Allaattiin kan dura bu'etu ija fudhata.
Allaattiin marsaa 'oolti, booddeen lafuma.
Allaattiin marsitee, marsitee, duuti lafa.
Allaattiin mukarra bule, yookaan baala yookaan baallii buusu malee hin ka'u.
Akkanas taatuu niitii ilma kiyyaa hin taatu.
Akkanattis yoo qalan gogaatu bada.
Akkanatti yoo qalan gogaan bada.
"Akkanatti nyaatanii dhirsa hin yaadan," jette haftuun.
Akkana nyaatanii, dhirsa hin yaadanii.
"Akkan beekuttan of ajjeesa" jette niitiin gorroo gubbaatti of rarraaftee.
"Akkaan beekuttan of hudha" jetteeti cifriggiin of huute jaartiin.
Akka ofii abbaatu beeka.
Akka ofii seetee haati intalatti dakkuu hiite.
Akka ollaan rafetti rafan.
Akka ollaatti hin bulan akka ofiitti bulu.
Akka ormaatti ragannaann morma nama jallisa.
Akka ormaatti ragannaatti mormi nama caba jedhan.
Akka ormaattiin sirba yoo jedhan mormi nama daba.
"Akka jedhan" jetteeti, lukkuun balbalaa gadi jette. 
"Akka kiyyaatiif maaltu ciisee naa kajeellata" jette sareen.
"Akka kiyyaatti maaltu naa kajeellata," jette sareen.
Akka kufaniin hin caban.
Akka kufaniin hin hafan.
Akka kufaniin hin hafan akka du'aniin hafan malee.
Akka kufanitti hin caban.
Akka kufanitti hin cabanu.
"Akka leencaan iyya," jettee weenniin sombaa dhoote.
"Akka leencaattan utaala," jetteeti booyyeen sonbaa dhoote.
Akka madaa qubaa yaanni garaa guba.
Akka madaa qubaatti yaanni garaa guba.
Akka madaa qubaa yaanni nama guba.
Akka manaa bulan malee akka ollaa hin bulan.
Akkuma waa argan waa haasa'an.
Akkuma wal fakkaattuun loon walitti 'oolfatti.
Akkuma dheebotaniin laga hin maddisan.
Alaa gaangeeni sin baatu, manaa sareen sin yaattu. 
Alaa kopheen ciq ciq, manaa garaan cir cir.
Alaa manatti dheeffan manaa 'eessatti dheeffan.
Alaa ni boonaa manaa ni booya.
Alaa rarra'a, manaa manca'a.
Alaa toluu manaa tola.
Alaa warratti dheessan, manaa eessatti dheessan.
Alaa dhufaan cuubata qal'isa.
Alagaafi dukkanatti ija hin babaasan.
Alagaafi dukkanatti ija hin baasan.
Alagaa gaafa qabaatan, fira gaafa rakkaatan.
Alagaa ilkaan adii alangaan isaa gadi.
Akka ormaatti sirbinaan morma nama jallisa.
Akka ormaatti sirbina yoo jedhan mormi nama daba. 
"Akka qambara cabsutti," jedhee namtichi indaaqqoo camade.
"Akka quuftetti miti, akka duraatti na nyaadhu" jedhe beeqelaan.
Akka sangaan fardaa itti oolu qalaamaan quba hin qabdu.
"Akkattan siif dhugaa bahe beektaa," jennaan "hamman si taajjabe beektaa," jedhe.
Akkatti bule abbaatu beeka ollaan akkam bultee beeka.
Akkatti kaattu, sareen ka duwwaa nyaattu.
Akka waan dhiyootti galtuu aduun bariisaaf turtee baate.
Akka dhaban akka'oo haadha godhatan.
Alagaa kolfaa sitti adeemuufi rooba addaatee roobu hin amaniin.
Alagaan gaafa qaabatan, firri gaafa rakkatan.
"Alaakee si waamee egaa na albaasi," jette harreen waraabessan.
Ala laalii mana seen.
Alala muran malee hiddi hin dhiigu.
Alalii heexoo mi'eesa.
Alamiin abbaan hin beekne fayyaadha.
Alamiin abbaan ofirratti hin beekne fayyaadha.
Alamiin lama hin deebitu.
Alamiin dhufuu yoo barbaadde karra marsiti yoo ba'uu barbaadde haadha warraafi abbaa warraati afaan dabarsiti.
Alangeen waaqa geeche lafa hin hanqattu.
Ala rafteeti, dhooftuu komatti.
Allaattiin muka korte yookaan baallii buusti, yookaan baala buusti.
Allaattiin odoo foon lafa jiruu waaqarratti wal fixxi.
Allaattiin olis kaattu gadis kaattu murteen lafuma.
Allaattiin waaqarra bararti, reeffi ishii lafa.
Allattiin waaqa irras kaachaa 'ooltu reeffi ishii lafuma. 
Allaattiin waaqarra duuti ishee lafarra.
Allaattiin waaqarraa kaachaa ooltu reenfi lafuma.
Allaattiin waaqa keessa raachi bishaan keessa, waaqatu waliin barbaada
Allaattii waaqa keessaafi raacha bishaan keessaa waaqatu waliin barbaada. 
Allaattii waaqa keessaa, raacha bishaan keessaa waaqatu waliin barbaada.
Albaadhessi hin quufu, gowwaan dhaba hin beeku.
Albeen fooniif bitan tiruurratti citti.
Bishaan yaa'aa buleeti, kan namaa hire warabbatan.
Bishaan yaa'aa buleetu, kan nama ga'e waraabbatu. 
Bishaan yaa'ee yaa'eetu, hamma namaa qabe waraabbatu.
Bishaan yaa'ee yaa'eetu, hanga namaa qabe woraabbatu
Bishaan yaa'u, bishaan ciisu 'oofa.
Bishaan yaa'utu, kan ciisu caala.
Bishaan yaa'utu, kan ciisu kaasa.
Bishaan yaa'utu, kan ciisu yaasa.
Bishaan yaa'uufi ilmi dhiiraa, torba kufeetu torba low ka'a.
Bishaan yammuu hanqachuudhaa deemu, ajaa'a; namni yammuu salphachuu kajeelu, boona.
Bishaan, dhagaa dubbisa.
Bishaan dhangala'e, hin hammaaramu.
Akka dhaban akkawoo haadha godhatan.
Akka dhaban akkayoo haadha godhatan.
"Akka dhaqa badde gala hin badin" jette qamaleen jaldeessaan.
Akka dheebotaniin laga hin maddisan.
Akki nyaataa nyaata, suummoon irbaata.
Akkuma cabanitti okkolan.
Akkuma cabanitti hokkolan.
Akkuma dur seetee, jartiin awwaala fakkaatte.
Akkuma itti jirantu jiruudha.
Akkuma iyyetti wal hin lolu.
"Akkuma laaqxetti na nyaadhu" jette suummoon.
"Akkuma miilanaatuu ta'ee hin beeku" jette hantuunni qooxii kortee.
"Akkuma uumu uuma," jedhe gowwaan haadha hudhee.
Akka hin cabne beekaati bishaan dhagaatti utala. 
Akka hin taanetti kufteeti na kaasaa boochi.
Akka hin dhoofne beektiif harreen dugda duubaan haadha luugdi.
Akka hin nyaanne luxxeessitee, akka hin dhiifne irra dibde.
Akka hin yaanne shaanaa marqitee, akka hin dhisne samaa baksite.
"Akka ijoolleen taa'a," jedhee jaarsi marcumaa aloo hulluuqee du'e.
Akka ilma godhattu utuu hin argin maqaa baafatte.
Akaa'iin ofittuu kofalti.
Akka itti bultu wallaaltee, "bultiin na dhibe" jetti nadheen.
Akka itti bultu wallaalteeti, "bultiin na dhibe" jette nadheen.
Biyya hin beekne, hin hawwan.
Biyya hin beekne, hiyyaadan.
Biyya hin deebinetti, dhaabbataniiti udaan hagan. 
Biyya hin 'oolle, kokkoflaati dhaqan.
"Biyya isa hinbeekne dhaqeeti, itillee naa afaa" jedhe waraabessi.
Biyya itti baroodanitti, deebi'anii hin gadoodan. 
Biyya itti hin deebine, balbala duratti hagan.
Biyya itti hin deebine, hudduurraa fudhatanii hagan. 
Biyya itti hin deebinetti, soqolatani iti hagu.
Biyya itti hin deebinetti, dhaabbatanii hagu.
Biyya itti hin deebine, dhaabbataniiti hagu
Biyya itti hin deebinu jedhan, dhaabbataniiti udaan hagan.
Biyya jaarsi jiru, wanti hin badu.
Biyya kanniisni moo'e,titichi nama sodaachisa.
Biyya abbaa kootii jetteeti, injiraan moluurratti rarraati.
Biyya abbaa kootiiti jetteeti, injiraan moluutti rarraati.
Biyya abbaa kooti jedheeti, hinjiraan moluurra taa'aa.
Biyya adurreen hin jirre, hantunni cidha baasa.
Biyya adurreen hin jirre, hantuunni cidha baasti.
Biyya adurreen hin jirre, hantuuti cidha baasa.
Biyyaafi biyyeetti deebi'uu,hin 'oolan.
Biyyaafi midhaan, waliin 'eegu.
Biyyaa bahuun, haa nu dabartuufi.
Biyyaa bawuun, nu haa dabartuufi.
Biyya badde, harreen garmaaman. 
Biyya badde, harreen garmaamu. 
Biyya badde, harreetu garmaamsa.
Bishaan gaasha qabu, gaaddiduudhaan beeku.
Bishaan haala gidir gabaabaa, jibbatti bu'ee dheeraa liqimsa.
Bishaan haala gidir gabaabaa jilba hingeechu, dheeraa mataarra garagalti.
Bishaan haraa cite, adeemsa jarjara.
Bishaan hin cabuu beekeeti dhagaatti bu'a.
Bishaan himmaraatee? jettee bulluqa dhugdee. 
Bishaan hiwwaadamu, malaan waadu malee.
Bishaan madda hin qabne hin yaa'u, yaa'us hin cita. 
Bishaan iddoo bulu hin qabu, jirma baatee deema. 
Bishaaniifi gowwaan, gara 'oofanitti deeman.
Bishaaniifi haati, hamtuu hin qabdu.
Bshaaniifi karaan, dhoorkaa hin qaban. 
Bishaaniifi karaan, dhoowwaa hin qabu. 
Bishaan kokkofalchiisaa, nama nyaata.
Bishaan darbaa deemu, sin fuudhiin.
Bishaan darbaa jiru, si hin nyaatiin.
Bishaan darbaa jiru si hin nyaatiin, jaarsi du'aaf jiru si hin abaariin.
Bishaan darbaa jiru si hin nyaatiin, jaarsi du'aa jiru si hin abaariin.
Bishaan drbaa jiru sin fudhatiin, jaarsi du'aa jiru sin abaariin.
Bishaan dabraa jiru sinfudhatiin, jaarsi du'aa jiru sinabaarin.
Bishaan darbaa jiru sin nyaatini, jaarsi du'aaf deemu sin abaariin.
Bishaan darbaa jiru sin fudhatiin, jaartiin du'aa jirtu sin abaariin.
Bishaan darbaa jiru sinyaatiin, jaarsi du'aa deemu sin abaariin.
Bishaan dhangala'e, hin haramu.
Bishaan dhugan malee, hin finca'aan.
Bishingaan bilchaate, kan muru hin dhabu.
Boo'aa ka'anii, imimmaan hin obsan.
Boo'a hin beektuu, dhagaa guuri.
Booda deemtee, gabaa hin komatin.
Booddeen, hooda taati.
Bofa ajjeesan, ulee wajjin gatan.
Bofa, akka bareedasaa mormatti maratanii deemu.
Bofa, beekeeti miila dhoowwe.
Bofa gara mataa rukutuun, akka du'uufi.
Bofa garaasaa ilaaleeti, waaqni kottee dhoowwate.
Bofa kan garaa laaleetu, Waaqni miila dhoowwate. 
Bofa kan garaasaa ilaaleeti, kottee isa dhoowwate. 
Bofa, mataatu du'a.
Bofa, mataa dhawu.
Biyya badde, harreedhaan garmaaman.
Biyya badde, harreedhaan garmaamu.
Biyya baruuf, kan jiru gaafatan malee kan du'e hin gaafatan.
Biyya biyyaa, simbiratu iyya.
Biyya cabsituun jirtuutti, hin guddatan.
Biyya dadhabne jedha, maraataan kan biyyi dadhabe.
Biyya duuti hin jirren dhaqa jedhee, biyya awwaalli hin jirre dhaqe.
Biyya duuti hin jirren dhaqaa jedheeti, biyya se awwaalli hin jirre dhaqe.
Biyya duuti hin jirren dhaqa jedheetiin, biyya du'an nama hin awwaalle dhaqe.
Biyya fardi bade, harreetu garmaama.
Biyya gaaniin hin jirre, farsoo okkoteetti nagan.
Bishaan mataa namaa ga'e, miila namaa hin hanqatu.
Bishaan miila ga'e, mataa hin hanqatu.
Bishaan miila gahe, mataa hin hangatu.
Bishaan muummichaa, boora'e hin tolu.
"Bishaan nama nyaate", jennaan isheen hubboo keessaa fakkarte.
Bishaan odoo kolfanuu, nama fudhata.
Bishaan ofiifuu bakka bultii hin qabu, guddicha baatee deema.
Bishaan ofiifuu bakka bultii hin qabu, muka baatee deema.
Bishaan, ol hiyyaa'u.
Bishaan raasan, dhadhaa hin baasan.
Bishaan, suutumaan dhakaa buqqisa.
Bishaan yaa'aa buleeti, kan namaaf hire waraabbatu.
Bishaan baduu deemu sinyaatin, jaarsi du'aa deemu sin abaariin.
Bishaan badu malee, hin magariisa'u.
Bishaan baduu ga'e, hin ajaa'a.
Bishaan baduu malte, magariisu guurti.
Bishaan baduudhaa ka'e, magariisa mara. 
Bishaan baduudhaa malte, magariisa guurti. 
Bishaan baduudhaa maltu, magariisa guurti. 
Bishaan bakka bultii hin qabne, muka baatee deema.
Bishaan bakka bultii hin qabne, muka harkisa.
Bishaan bakka bultii hin qabu, gudeelcha baateeti deema.
Bishaan bakka bulu hin qabne, gudeelcha 'oofee deema.
Bishaan bara baase, ganna abaaran.
Biyya ormaa, dhaquun nama hin dhibu galuutu nama dhiba.
Biyya qaaniin badde, harreetu garmaama. 
Biyya qaaniin hin jirre, harreedhaan gulufu. 
Biyya qilxuun hin jirre, micireen abdaarii taati. 
Biyya salphaan jiru, ulfaataan gatii hin qabu. 
Biyya tokko, ilmi hin taa'aa abbaan hin qota. 
Biyya tokko, karaa hin cufatan afaan cufatan. 
Biyya tuffatan, harreen gonbisu.
Biyya tuffatan, harreedhaan garmaman.
Biyya tuffatan, harreedhaan gombisan.
Biyya tuffatan, harreedhaan gombisu.
Biyya tuffatan, harreedhaan gonbisa dhaqan. 
Biyya tuffatan, harreedhaan gonbisa dhaqu.
Biyya tuffatan, harreedhaan gonbisu.
Biyya ufiitti, lukkuun korma.
Bittaanis yaabbatan mirgaanis yaabbatan walgayiin kooraadha.
Bitaan koranii mirgaan, walgayiin kooraa.
Bitaan koran mirgaanis koran, walgeenyi kooradha.
Bitaan koran mirgaan, walgeenyi kooraadha. 
Bitaan kori mirgaan kori, walga'iin kooraadha. 
Bitaan kori mirgaan kori,walgeettiin kooraadha.
Bitaan kori mirgaan kori,walgeenyi kooraadha. 
Bitaan kortus mirgaan kortus, walga'iin kooraadhuma.
Bitaan kortus mirgaan kortus, walgahi kooraadha.
Bitaan kortus mirgaan kortus, walga'iin kooraadhuma.
Bitaan kortus mirgaan kortus, walgeenyi kooraadha.
Bitaas kori mirgaas kori, walgeenyi kooruma.
Biyya kormi hin jirretti, harreetu halaaka.
Biyya tuffatan, harreedhaan garmaaman.
"Biyya maal na fidde, biyya baalli huddu nama gubu" jedhe namichi doobbiidhaan hudduu haqatee.
Biyya midhaan hin jirre, caabotaan midhaani.
Biyya mukti hin jirre, margatti hirreeffatu.
Biyya nama hin beeknetti, dhaabbatanii hagan.
Biyya nadheen quufte, harreetu garmaama.
Biyya ofiitti, lugnuu korma.
Biyya ofiititti, lukkuun korma.
Biyya ormaa, deemuun nama hindhibu galuutu nama dhiba.
Biyya ormaatti,cooma nyaataniiti daadhii dhugan malee iitti hin hafan.
Biyya ormaa, dhaquun nama hin dhibu galuun nama dhiba.
Bitaa mirgas koran, walgeenyi kooruma.
Bitaadhaanis koran mirgaanis koran,walgeenyi kooruma.
Bitaas yaabbatan mirgaas yaabbatan, walgeenyi kooruma.
Bitata wallaalanii, gabaa abaaran.
Bittaa wallaalanii, gabaa abaaranii.
Biyya abbaa kiyyaa hin gallakkisu jetteeti, injiraan moluurratti duute.
Biyya abba kiyyaati jettee, injiraan moluu gubbaa teesse.
Biyya abbaa koo hin gadhiisu jettee, injiraan moluurratti hafte.
Biyya abbaa kootii hin gadhiisu jettee, daljeettiin hallayaa qabattee.
Biyya abbaa kootii jettee, injiraan moluurratti haftee.
Biyya tulluun hin jirre, randaarra dhaabbatu.
Biyya dhugaan badde, halkan cabbii rooba.
Biyya shaniin ka'an, shantamaan hin argan.
Biyyee nyaatanii hin fixan, nyaatteeti nama fixxi malee.
Biyyeen, namaaf galata hin qabdu.
Biyyi arganii hin beekne, daadhii qaba.
Biyyi mootummaa hin qabneefi kanniisni mootii hin qabne, tokko.
Biyyi ni rafaaf, jaamaan ol dabarti.
Bicheen ittuu bicheedhaa ammammoo siiquu argatee?
Bishaan akka baatanitti dhugan malee, akka inni nama baatutti hin dhugan.
Bishaan baduu deemu, haafa guura.
Bishaan baduu deemu, magariisa guura.
Bisaan darbaa jiru si hin nyaatin, jaarsi du'aa jiru si hin abarin.
Bitaanis koran mirgaanis koran walgeeny kooraadha.
Bitaanis koran mirgaanis koran walgayiin kooruma.
Bitaanis koran, mirganis koran walgeenyi kooruma. 
Bitaanis koran mirgaanis koran walga'iin kooraadha.
Bitaanis kori, mirgaanis kori, walgeenyi kooraadha.
Bitaanis kortu, mirgaanis kortu walgeenyi kooraadhuma.
Bitaanis koru, mirgaanis koru, walgeenyi koruma.
Bitaanis koran mirgaan, walgeenyi kooruma.
Bitaanis mirgaanis koran, walgeenyi kooruma.
Bitaanis mirgaanis yaabbatan, walgeenyi kooruma. 
Bitaanis yaabbatan mirgaanis yaabbatan, walgeenyi kooruma.
Bineensi nama nyaatuurraa nyaatanii falchuu wayya.
Bineensi nama nyachuu mannaa, nyaatanii lulluuqqachu wayya.
Bineessi niitiin firgite nyaatu malee hingalu.
Bineensi ollaa hin nyaatu hoo dhabe agabuu hin bulu.
Bineensi sodaataan gurra harree dheecha.
Bineensi waan alkan godhuuf guyyaa dheessa.
Bineensi waan halkan godhe beekaaf guyyaa nama dhokata.
Bineensi waan halkan hojjetu beekaaf guyyaa nama dheeffa.
Bineensi waan halkan hojjetu beekaa guyyaa nama dheessa.
"Biqilli waggaa tokkicha fannisaniiti gaafa tokkicha nama fannisa," jedhan.
Bishaan darbe, hin woraaban.
Bishaan darbuu deemu sin fudhatiin, jaarsi du'uu deemu sin abaariin.
Bishaan darbuu jiru sin fudhatiin, jaarsi du'aa ga'ee sin abaariin.
Bishaan gabatee keessa, gara qabanitti dhangala'a. 
Bishaan gadi namme, hin hammaaramu.
Bishaan gala ga'e sin nyaatiin, jaarssi du'a ga'e sin abaariin.
Bishaan gala ga'e sinyaatiin; namni du'a ga'e sin abaariin.
Bishaan gala gahe sinyaatiin, ijoolleen guddattu sin jibbiin, jaarsi dulloome sin abariin.
Bishaan, gara jigeetti dhangala'a.
Bishaan, gara jigutti dhangala'a.
Bishaan, gara matansaa yaa'etti yaa'aa.
"Bareeduma wajjin hin deemne dhalootaf malee jette daljettiin.
Bareedaafi asheeta bira hin dabran.
Bareedaafi asheeta bira hin darban.
Bareedaa alagaarra fokkisaa firaa wayya.
Bareeda alagaarraa fokkisaa fira ofii wayya. 
Bareeda fuulaa dhiqanii hin dhuugan.
"Bareedde barreedde," jennaan intalli haadha kabalte.
"Bareedde baredde," jennaan intalli ija babaafte.
Bareeda alagaatirra fokkisaa fira ofii wayya.
Bareednni afaaniin nama seena.
Bareennifihoriin nama gowwoomsti.
Bareednni dhaloota.
Bari'een iyya hindaaqqootiin booda.
Bishaan kokkofalchiisaa, nama fudhata. 
Bishaan kokkofalchiisaati, nama nyaata.
Bishaan kokkofalchiiseeti, nama nyaata. 
"Bishaan maaliif iyyaa," jennaan "dhaqii dhagaa gaafadhu", jedhe.
"Biashaan maaliif iyyaa," jennaan "dhaqii dhagaa keessa jiru gaafadhu", jedheen.
Bishaan maaltu goosaa? Jennaan "waan keessa jiru", jedhe.
Bishaan marqaa, marqaadhumatti dhuma.
Bishaan marqaa, marqumatti dhuma.
Bishaan mataa ga'e, luka hin hanqatu. 
Bishaan mataa ga'e, miila hin hanqatu. 
Bishaan mataa gahe, miila hin hanqatu. 
Bishaan mataa gahu, miila hin hanqatu. 
Bishaan mataa gaye, miila hin hanqatu.
Bararaas ooltuus, allaattii reeffii lafuma.
"Barar," jette barariin mana goondaa dhaqxee. 
Bararte barartu reefii culuullee lafuma.
Bara siif tole gumaa saree keetii baasii, bara sitti bade gumaa abbaa keetiituu balleessi.
Bara siif tole gumaa saree keetu baasi, bara sitti bade gumaa abbaa keetu balleesi.
Bara sii tole gumaa saree keetii baasi, bara sitti dabe gumaa abbaa keetii balleessi.
Bara sitti tole gumaa harree baasii.
Bara tokko tokko hantuunni gachana qaba.
"Baratu beeka," jedhe Gurmuu Masqalee lafa gurguree.
"Baratuu naaf kenne", jedhe oluma utaalee sangaa
fardaa lafaan dhahee kormaan hindaaqqoo.
"Baratu naa kenne," jedhe, ol utalee sangaa fardaa kuffise kormaan hindaaqoo.
Barcumarra taa'anii muka hin hamatan.
Barcuma ulfinaa abbaatu of jalaa baata.
Barbadaan daaraa dhalaa.
Barbaree harkaan bitanii, gubaashii sodaatan.
Barbaree harkaan dhaabanii guba sodaatan.
Barbaree hin soran walmalee hin tolan.
Barbareen haarkaan dhaabanii booda ija nama guba.
Barbareen harkaan dhaabaniiti nama gubdi.
Barbareen harkaan dhaabantu nama guba. 
"Bareedde" jennaan mucaan ija babaafte.
Bareeddeef fira hin fuudhan.
"Bareedde," jennaan intalli ija babaafte.
"Bareedde" jennaan mucayyoon ija babaaste.
Bareeddun ofuma gameetti seeti.
Bareeninaaf obboleeytii hin fuudhan.
"Bara Waaqni," jedhe buqqeen dhakaa cabsiti
Bara Waaqni nama qabe, bishaantu muka yaabbata.
Bara Waaqni namatti dheekkame qooxiin namaan raafama, 
Bara yaraa qulqullaayuun badaa.
Barbareen harkumaan dhaabaniiti nama gubdi.
Barbareen ofii dhaabaniiti nama gubdi.
Barbareen ofii dhaabanii nama gubdi.
Barbareen ofumaa dhaabaniiti nama gubdi. 
Barbaree ofii dhaabaniiti nama gubdi.
Barbaree ufuumaa dhaabanii nama gubdi.
Barbaree nyaata ishiirra, gubaashii sodaanne.
Barcumaafi ulfina abbaatu of jalaan deema.
Barcumaafi ulfina abbaatu uf jala baata.
Baraafi saree hin himatanu.
Baraafii saree hin kasasan. 
Baraan barruu horan.
Baraan barruu horu.
Bara namaa guutte darbanii diinqa ciisan.
"Bara gadhee," jette lukkuun farda dhiittee. 
Bara hamaa gadi jeedhanii dabarfatu. 
Bara hamaa gadi jedhaniiti dabarfatan. 
Bara hammaatte qocaatu nama nyaata. 
Bara iyyeessi quufe dureessi dhuufe. 
"Bara," jettee handaaqqoon farda dhiitte.
"Bara," jettee lukkuun farda dhiittee.
"Bara," jettee hindaanqon farda dhiitte.
Bara kanniisni mohe, tisiisni nama sodaachisa.
"Bara kinniifni nama idde tisiisnillee nama kajeela," jedhama.
Billaachoon ofiifuu hin qabduu dhagaatti uffisti.
Bilbilli fardarraa malee hareerraa hin bareedu.
Billoofni abbaan qare, abbaa qale.
Bineensa afaan waraanuun garaa tolu.
Bineensa dabree saren dutte.
Bineensa dabree sareen dutti.
Bineensa darbe sareen dutte.
Bineensa darbe sareen dutti.
Bineensa gowwaa boolla keessatti si'a lama waraanu.
Bineessa kamisa darbee sareen jimaata dutte. 
Bineensi bakka tokko nyaate sagal itti deebi'a. 
"Bineensi biyya himbeekne deemeeti ittillee naaf afaa,"jedhe.
"Bineensi biyya himbeekne deemeeti itillee naa hafaa" jedhe.
Bara leenci nama nyaate deeroonis nama kajeelti 
Bara leenci nama nyaate fociin dalga nama laalti 
Bara malee baranaaf malee sombi kan saree. 
Bara malee, baranaa malee, sombi kan sareeti. 
Baraan bartuu baran.
Bara "maal nyaannaa," jedhan, cooma nama nyaachisa.
Bara "maal nyaadhu," jedhan, cooma nama nyaachisa.
Bara namaa guutetti kaabii kaabbatan.
Bararaa 'ooltee allaattin duuti lafa.
." Baranoon beekte" jennaan, mooyyee dhiqxe.
Baran quufeen warra du'aa dhaqa.
Bara quufaa indaaqqotu dhuufa.
Bararaa 'oolii allaattii reeffii ishee lafa.
Bararaa ooltuus, allaattii duutii lafuma.
Baqataan goota hin qabu.
Bara adurreen duute hantuunni cidha baasa.
Bara barri hammaate bishaan muka namatti yaaba.
Bara bofni hammaate lootuun nama kajeeliti.
Bara bofni nama ciniine lootuun mataa namatti raafti.
Bara bofni nama hidde qarcoon ija namatti babaasti. 
Bara bofni nama nyaate lootuun afaan namatti banti. 
Bara bofni nama nyaate lootuun ija namatti babaafti. 
Bara bofni nama nyaate lootuun nama kajeelti. 
Bara bofni nama nyaate, qarcoon afaan namatti banti"
Bara bofti nama hidde lootuun arraba namatii baafti.
Bara bofti nama hidde lootuun nama kajeelti.
Bara bofti nama hidde qarcoon ija namatti babaasti.
Bara bofti nama ciniine lootuunis nama kajeelti.
Bineensi biyya himbeekne dhaqeeti ittillee naa afaa," jedhe.
"Bineessi biyya himbeekne dhaqee gogaa naa afaa," jedhe.
"Bineessi biyya ormaa deemeeti itillee naa afaa," jedhe.
Bineensi biyya ormaa nama nyaachurra bineessi biyya ofi nama nyaachuu wayya.
Bineensi dura argan nama hin nyaatu.
Bineensi guyyaa argan alkan nama hin nyaatu.
Bineensi guyyaa yuuse beekkachiise.
Bineenssi guyyaa yuuse nama hubachiise.
"Bineensi maa guyyaa deemuu dida," jennaan waan galgala balleessu beekaaf.
Bineensi nama nyaatu baayyeedha, kan maqaan ba'eef waraabessuma.
Bara duuti hammaate haadha ilma tokkootu bade 
Baraaf furguggee abbaatu dabarfata.
Baraafi furguggee gadi jedhaniiti darbu. 
Baraafi furguggee gadi jedhanii jala bawu. 
Baraafi furguggee gadi jedhanii dabarfatan. 
Baraafi furguggee, jalaa gajjadhaniiti dabarsan. 
Baraafi furguggee jalaa gad jedhaniiti dabarfatan 
Baraafi furgugee mataa gadi qabatanii dabarfata 
Baraafi murxuxxee gadi jedhanii dabarsu.
Baraafi murxuxxee gadi jedhaniitu jala ba'u.
Baraafi murxuxexe gadi jedhaniit jalaa ba'u.
Baraafi ganyaan nama kuffifti.
Baraafi ganyaatu nama kuffisa.
Baraafi gufuu gufatani jala ba'u.
Baraafi malee, baranaaf malee, sombi kan sareeti.
Baraafi midhaan wal hin argu.
"Bushaa'aa bushaa'aa," jedhe seexanni bishaan gaayyaa dhugee.
"Bushaa bushaa" jedhe, waraabessi harree fixee.
"Bushaa bushaa" jedhe, waraabessi harree tuffatee. 
Bushaawuurra, dhangaggaawuu wayya.
Bushaa'uu mannaa, dhangaggaa'uu wayya.
"Bushaa'uu mannaa, dhangaggaa'uu wayya" jette raafuun.
Bushaa'uudhaa mannaa, dhangaggaa'uu wayya.
"Bara bofti nama nyaate lootuun afaan namatti banti" jedhan.
Bara bofti nama nyaate lootuun arraba namatti baafti.
Bara bofti nama nyaate lootuun ija namatti baasti. 
Bara bofti nama nyaate lootuun nama kajeeltii. 
Bara bofti nama nyaate qarcoon ija namatti baasti. 
Bara bofti nama nyaate, qunceen afaan namatti bana.
"Bara darbaa jiru goommana nyaanna," jett beerran.
Bara darbaa jiru yaa garaa koo raafuu na nyaachifte.
Bara darbeef mana hin ijaaran.
Bara darbee mana hin ijaaran.
Bara duuba baratu jira.
Balbala gowwaatii hordaa muratu.
Balballeettiin intalaa haadha da'a barsiifte. 
Balballiifi ijoolleen odoo nama laalanuu nyaatan.
Balballiifi ijoolleen oduma nama laaltuu nyaatan. 
Balballi morkaa odoo hin cufamin bula.
Balballi morkaa otoo hin cufamin bula.
Balballi morkii banaa bula.
Balgii baalatti hin jajan, dubara warratti hin jajan.
"Ballaadhaan bakkalcha koo," jetti haati.
Ballaadhaan, "boru fayyita", jennaan "har'a akkamitti bulee," jedhe.
Balleessuun nama hin dhibu, tolchuutu nama dhiba. 
"Bannee hin banne" jette hantuunni xaafii keessaa as baatee.
"Banneeti baane," jette gogorriin kiyyoo qurxattee. 
Baqaqaan lafa dhiba, baqanni abbaa maatii dhiba.
, Barri taraadha.
Barri tokko olii tokko gadi.
Bararus alaatti reeffi lafa.
"Baasa baalaa," jedhe jaarsi doobbiin hudduu haqatee.
Basalaqaan bulluqa alanfata.
"Basaan baasaa" gadi abaasaa jette haftuun. 
"Basmaam jedha maammiruun" jette niitiin. 
Bassoo nyaatanii laga rafuun tuffii seexanaati moo badii qaalluutii.
Bayeessaafi qunnaa safaraa biyyatu beeka. 
Baay'inaaf tiitisi elmtuu hin buqqaafne.
Bacho rimaa'a hin bitu, kan dhalte jalaa hatuu malee.
"Beeka, beeka," jettee jaartiin kitaaba dhiyxi.
"Beekaa na geggeessitee wallaalaa na biraa hin deebi'in," jette niitiin.
"Boru si fuudhaan na sobuudha," jette haftuun.
Boosattiin hin dhiqattu, gaafa dhiqattu of quncaafti, 
Boosattiin kan nyaatte odoo hin argiin, ka ittih nyaatte argan.
Boosattiin waan nyaattu hin argan, waan nyaatte afaan isiirratti argan.
Boosattiin waan nyaattu hin argan, waan nyaatte afaan isheerratti argu.
Boosettiin waan nyaattu hin arganii, waan nyaatte afaanirratti argu.
Boosettiin waan nyaattu hin argan, waan nyaatte afaan ishiirratti argu.
Boosettii waan nyaattu hin arganii, waan nyaatte afaan ishiirratti argu.
Boosoon hin ulattu, yoo ulatte mana gubdi.
"Booyyeen, amma leencaan bokkisa" jettee, hudduudhaa dhoote.
Bultiin badde, bultii tolte caalaa namatti oo'iti
Bultiin, wasaasaadha.
Bullukkoofi naxalaa, abbaatu keessaa filata.
, Bullukkoofi naxalaa, abbaatu walii filata.
Bulluqni, bulluqa hin hirkisu.
Buna lubbuuf xaaxa'u, warri naaf tolii kadhata. 
Buna lubbuuf xaaxa'u, warri naa tolii kadhata. 
Buna lubbuuf xaaxa'u, worri naa tolii kadhatu.
Bunni ciree hin qabneefi dubbiin wilii hin qabne, sele tokko.
Bunni ciree qabdi, dubbiin galcha qabdi.
Bunqulloo fudhateetu, dhagaa nama fudhachiisa.
Buqqee duudaa, bishaan hin seenu.
Buqqee duudaa, qubni hin seenu.
Buqqee dudeetti, bishaan hin seenu.
Buqqee lama mannaa, cirracha tokko wayya.
Beekaan bade deebii hin qabu.
Beekaan cadheedheedhaan wallaalaan arridhaan. 
Beekaan dubbiin takka.
"Beeka, beeka," jettee niitiin kitaaba miiccite.
"Beeka, beeka," jettee niitiin kitaaba dhiqxee.
"Beeka, beeka," jetee niitiin kitaaba qeesii dhiqxe. 
"Beeka, beeka," jetteeti niitiini qeesii macaafa dhiqxe.
Beekan fufii hin qabu, gowwan mala hin qabu.
Beekaan galgala dubbata.
Beekaan galgala dhufa.
Beekaan guduruudhaan beeka wallaalaan ammoo arridhaan wallaala.
Beekaan kan dubbatu beeka, wallaalaan, kan beeku dubata.
Beekaan lafattuu beeka, wallaalaa gorsi hin danda'u.
Bofa tan garaasaa laaleeti, luka dhoowwate. 
Bofni guyyaa argan, halkan nama hin nyaatu. 
Bofni biyyee wajjiin, namni biyya wajjiin. 
Bofni boolla takkatti, lama nama hin ciniinu. 
Bofni xiqqaadha jedhanil, mataarra hin ejjetan.
Bofti boolla tokkotti, yeroo lama nama hin ciniinu. 
Bofti guyyaa argan, nama hin nyaatu.
Bofti nama dheessa namni bofa dheessa, lafti gidduutti hafe.
Bofti nama dheecha namni bofa dheecha, lafti jedduutti hafte.
Bofti miila hin qabu, garaachumaan loo'a.
Bokkaaf golfaa, faggeenyatti dheessu.
Bokkaafi golfaa, fagootti dheessu.
Bokkaa hin jirre, gasaa hin baatan.
